[
 {"company":{"name":"Burlap & Barrel","aliases":["Burlap and Barrel"],"legal_entities":["Burlap & Barrel (company describes itself as a Public Benefit Corporation)"],"successor_or_acquirer":null},"status":"operating","as_of":"2026-09-10","confidence":"high","episode_appearances":[{"season":14,"episode":19,"episode_date":"2023-04-07","video_title":"ABC — businesses from S14E19","video_url":"https://abc.com/news/2048faca-7a46-448e-ad64-a7ac011d8bc2/category/2887649","kind":"episode","pitch":"Single-origin spices sourced directly from partner farmers.","ask":"$500,000 for 5% equity.","offer":"No Shark investment closing is asserted from the reviewed sources.","deal_closed":null}],"timeline":[{"date":"2023-04-07","event":"ABC lists Burlap & Barrel with Parting Stone, Cincha Travel and Milkify.","source_ids":["BB-ABC"]},{"date":"2026-09-10","event":"The company identifies Ethan Frisch and Ori Zohar as co-founders and co-CEOs and describes itself as a Public Benefit Corporation.","source_ids":["BB-SITE"]}],"registry_records":[],"claims":[{"id":"BB-OPERATING","text":"The current official site supports operating commercial presence and identifies the founders; entity-specific state standing was not independently retrieved.","evidence_level":"strong_corroboration","source_ids":["BB-SITE"]},{"id":"BB-DEAL","text":"No Shark investment is treated as closed without executed transaction evidence.","evidence_level":"unresolved","source_ids":["BB-ABC"]}],"sources":[{"id":"BB-ABC","title":"ABC — businesses from S14E19","url":"https://abc.com/news/2048faca-7a46-448e-ad64-a7ac011d8bc2/category/2887649","source_type":"official episode roster","published":"2023-04-07","accessed":"2026-09-10"},{"id":"BB-SITE","title":"Burlap & Barrel official about page","url":"https://www.burlapandbarrel.com/pages/about-us","source_type":"company page","published":null,"accessed":"2026-09-10"}],"uncertainties":["Entity-specific standing, ownership changes, financing terms and historical archive comparison remain unresolved."]},
 {"company":{"name":"Business Ghost","aliases":["BusinessGhost","Michael Levin Writing Experience"],"legal_entities":[],"successor_or_acquirer":null},"status":"unresolved","as_of":"2026-09-10","confidence":"low","episode_appearances":[{"season":3,"episode":1,"episode_date":"2012-01-20","video_title":"ABC — Season 3, episode 10 roster","video_url":"https://abc.com/news/6e89b95f-ae77-4aac-96c3-062d0b3ec447/category/939724","kind":"episode","pitch":"Ghostwriting services for books by celebrities and business leaders.","ask":"$200,000 for 10% equity.","offer":"No Shark deal is recorded in reviewed first-party material.","deal_closed":false}],"timeline":[{"date":"2012-01-20","event":"Business Ghost appeared in the Season 3 premiere; ABC's later episode page preserves its roster with Clean Bottle, My Wonderful Life and EZ VIP.","source_ids":["BG-ABC"]},{"date":"2026-09-10","event":"The former Business Ghost domain redirects to an unrelated organization.","source_ids":["BG-DOMAIN"]}],"registry_records":[],"claims":[{"id":"BG-STATUS","text":"The former domain's unrelated redirect does not establish closure, acquisition, rebranding, or the identity of any successor. Current legal and commercial status is unresolved.","evidence_level":"unresolved","source_ids":["BG-DOMAIN"]},{"id":"BG-ACQUISITION","text":"Secondary reports describe an acquisition, but no primary announcement, transaction record, or entity-specific registry evidence was retrieved; the tracker therefore does not assert an acquisition.","evidence_level":"unresolved","source_ids":["BG-DOMAIN"]}],"sources":[{"id":"BG-ABC","title":"ABC — Season 3, episode 10 roster","url":"https://abc.com/news/6e89b95f-ae77-4aac-96c3-062d0b3ec447/category/939724","source_type":"official episode roster","published":"2013-07-25","accessed":"2026-09-10"},{"id":"BG-DOMAIN","title":"Business Ghost domain response","url":"https://businessghost.com/","source_type":"domain response","published":null,"accessed":"2026-09-10"}],"uncertainties":["The ABC page's title carries a historic episode-number discrepancy; the original 2012 air date, entity-specific standing, ownership, claimed acquisition, successor relationship and archive comparison remain unresolved."]},
 {"company":{"name":"Busy Baby Mat","aliases":["Busy Baby","Busy Baby Mat LLC"],"legal_entities":[],"successor_or_acquirer":null},"status":"operating","as_of":"2026-09-10","confidence":"high","episode_appearances":[{"season":12,"episode":16,"episode_date":"2021-03-05","video_title":"ABC — businesses from S12E16","video_url":"https://abc.com/news/49479b6f-fb2e-430f-8bd2-74ce03891bb8/category/2887649","kind":"episode","pitch":"Silicone placemat and tether system intended to keep baby items within reach.","ask":null,"offer":"Televised deal terms and executed transaction evidence were not retrieved.","deal_closed":null}],"timeline":[{"date":"2021-03-05","event":"ABC lists Busy Baby with Simply Good Jars, Pinch Me Therapy Dough and Muff Waders.","source_ids":["BBM-ABC"]},{"date":"2026-09-10","event":"The official storefront lists Busy Baby products and purchase paths.","source_ids":["BBM-SITE"]}],"registry_records":[],"claims":[{"id":"BBM-OPERATING","text":"The current official storefront supports operating commercial presence; purchase fulfillment and entity-specific state standing were not independently tested.","evidence_level":"verified_fact","source_ids":["BBM-SITE"]},{"id":"BBM-DEAL","text":"A televised deal is not treated as closed financing without executed transaction evidence.","evidence_level":"unresolved","source_ids":["BBM-ABC"]}],"sources":[{"id":"BBM-ABC","title":"ABC — businesses from S12E16","url":"https://abc.com/news/49479b6f-fb2e-430f-8bd2-74ce03891bb8/category/2887649","source_type":"official episode roster","published":"2021-03-05","accessed":"2026-09-10"},{"id":"BBM-SITE","title":"Busy Baby official storefront","url":"https://busybabymat.com/","source_type":"company storefront","published":null,"accessed":"2026-09-10"}],"uncertainties":["Entity-specific standing, executed investment terms, ownership changes and historical archive comparison remain unresolved."]},
 {"company":{"name":"BusyBox","aliases":["BusyBox Corp.","BusyBox Sign"],"legal_entities":[],"successor_or_acquirer":null},"status":"operating","as_of":"2026-09-10","confidence":"high","episode_appearances":[{"season":13,"episode":19,"episode_date":"2022-04-08","video_title":"ABC — businesses from S13E19","video_url":"https://abc.com/news/5575b786-84cf-4108-b778-ece4f33ec937/category/2887649","kind":"episode","pitch":"Smart do-not-disturb signs for work-from-home and creator spaces.","ask":null,"offer":"Company says the televised appearance did not result in a deal.","deal_closed":false}],"timeline":[{"date":"2022-04-08","event":"ABC lists BusyBox with LUCIDArt, SwiftPaws and Dirty Cookie.","source_ids":["BX-ABC"]},{"date":"2023-03-07","event":"BusyBox's own post says its Shark Tank appearance did not result in a deal.","source_ids":["BX-SITE"]},{"date":"2026-09-10","event":"The current official storefront lists smart-sign products and identifies the CEO/co-founder.","source_ids":["BX-SITE"]}],"registry_records":[],"claims":[{"id":"BX-OPERATING","text":"The current official storefront supports operating commercial presence; purchase fulfillment and entity-specific state standing were not independently tested.","evidence_level":"verified_fact","source_ids":["BX-SITE"]},{"id":"BX-DEAL","text":"The company's post-show account supports that the televised appearance did not yield a deal, while not substituting for transaction-record review.","evidence_level":"verified_fact","source_ids":["BX-SITE"]}],"sources":[{"id":"BX-ABC","title":"ABC — businesses from S13E19","url":"https://abc.com/news/5575b786-84cf-4108-b778-ece4f33ec937/category/2887649","source_type":"official episode roster","published":"2022-04-08","accessed":"2026-09-10"},{"id":"BX-SITE","title":"BusyBox official Shark Tank account","url":"https://shop.busyboxsign.com/blogs/pay-it-forward/shark-tank-questions-for-busybox","source_type":"company post","published":"2023-03-07","accessed":"2026-09-10"}],"uncertainties":["Entity-specific standing, ownership changes and historical archive comparison remain unresolved."]}
]
