[
 {"company":{"name":"BRUW","aliases":["BRUW, LLC"],"legal_entities":[],"successor_or_acquirer":"Snarky Tea"},"status":"acquired","as_of":"2026-09-10","confidence":"high","episode_appearances":[{"season":10,"episode":9,"episode_date":"2019-01-06","video_title":"TVDB — S10E9 roster","video_url":"https://thetvdb.plex.tv/series/shark-tank/allseasons/official","kind":"episode","pitch":"Cold-brew coffee filter.","ask":"$50,000 for 25% equity.","offer":"Contemporaneous reporting describes a televised $50,000-for-30% Cuban agreement; Forbes later reports $50,000 for 25%.","deal_closed":true}],"timeline":[{"date":"2019-01-06","event":"Contemporaneous reporting describes a $50,000-for-30% televised Cuban agreement after a $50,000-for-25% ask.","source_ids":["BRUW-LOCAL"]},{"date":"2020","event":"Forbes and Babson report BRUW was acquired by Snarky Tea; purchase agreement and consideration were not retrieved.","source_ids":["BRUW-FORBES","BRUW-BABSON"]},{"date":"2023-01-10","event":"Forbes reported that BRUW raised $50,000 from Cuban for 25% after its Season 10 appearance.","source_ids":["BRUW-FORBES"]}],"registry_records":[],"claims":[{"id":"BRUW-ACQ","text":"Forbes and Babson independently report that BRUW was acquired by Snarky Tea in 2020. The transaction structure, consideration and IP assignment were not retrieved.","evidence_level":"strong_corroboration","source_ids":["BRUW-FORBES","BRUW-BABSON"]},{"id":"BRUW-DEAL","text":"Forbes reports $50,000 from Cuban for 25%, differing from the 30% televised agreement in contemporaneous reporting. Both versions are preserved; no executed investment document was retrieved.","evidence_level":"strong_corroboration","source_ids":["BRUW-FORBES","BRUW-LOCAL"]}],"sources":[{"id":"BRUW-FORBES","title":"Forbes — Shark Tank deal outcomes","url":"https://www.forbes.com/sites/jemimamcevoy/2023/01/10/inside-the-secretive-world-of-shark-tank-deals-who-the-real-winners-are/","source_type":"reputable post-show reporting","published":"2023-01-10","accessed":"2026-09-10"},{"id":"BRUW-BABSON","title":"Babson College — BRUW founder profile","url":"https://entrepreneurship.babson.edu/babson-shark-tank-products/","source_type":"university publication","published":"2023-10-17","accessed":"2026-09-10"},{"id":"BRUW-LOCAL","title":"Deadline Detroit — BRUW Shark Tank report","url":"https://www.deadlinedetroit.com/articles/21369/updated_west_bloomfield_teen_on_abc_s_shark_tank_we_got_a_deal","source_type":"contemporaneous reporting","published":"2019-01-06","accessed":"2026-09-10"}],"uncertainties":["Executed investment and acquisition documents, state standing and historical archive comparisons remain unresolved."]},
 {"company":{"name":"Brümachen","aliases":["BRUMACHEN","BRÜMACHEN, LLC"],"legal_entities":[],"successor_or_acquirer":null},"status":"unresolved","as_of":"2026-09-10","confidence":"low","episode_appearances":[{"season":12,"episode":11,"episode_date":"2021-01-22","video_title":"ABC — businesses from S12E11","video_url":"https://abc.com/news/2827a6be-9de4-4044-8405-b866c44c8df2/category/2887649","kind":"episode","pitch":"Portable single-serve coffee brewer.","ask":"$1,000,000 for 10% equity.","offer":"No deal.","deal_closed":false}],"timeline":[{"date":"2021-01-22","event":"ABC's S12E11 roster lists Brümachen with Quevos, Aura Bora and SwipenSnap.","source_ids":["BRUM-ABC"]},{"date":"2021","event":"Company crowdfunding updates describe funding and shipping constraints; these do not establish fraud, insolvency or final legal status.","source_ids":["BRUM-BACKERKIT"]}],"registry_records":[],"claims":[{"id":"BRUM-STATUS","text":"Current commercial and legal status remains unresolved. Secondary reporting of an Indiana dissolution was not promoted because an entity-specific state record was not retrieved.","evidence_level":"unresolved","source_ids":["BRUM-BACKERKIT","BRUM-ABC"]}],"sources":[{"id":"BRUM-ABC","title":"ABC — businesses from S12E11","url":"https://abc.com/news/2827a6be-9de4-4044-8405-b866c44c8df2/category/2887649","source_type":"official episode roster","published":"2021-01-22","accessed":"2026-09-10"},{"id":"BRUM-BACKERKIT","title":"Brümachen BackerKit project updates","url":"https://brumachen.backerkit.com/hosted_preorders/project_updates","source_type":"company crowdfunding updates","published":null,"accessed":"2026-09-10"}],"uncertainties":["Entity-specific Indiana standing, commercial cessation, successor ownership and archive comparisons remain unresolved."]},
 {"company":{"name":"Bubbly Blaster","aliases":["Bubbly Blaster, LLC"],"legal_entities":["Bubbly Blaster LLC (company policy self-identification; state standing unverified)"],"successor_or_acquirer":null},"status":"operating","as_of":"2026-09-10","confidence":"medium","episode_appearances":[{"season":12,"episode":10,"episode_date":"2021-01-15","video_title":"ABC — businesses from S12E10","video_url":"https://abc.com/news/febba6fd-cf91-428e-bc43-a3543a6a6845/category/2887649","kind":"episode","pitch":"Champagne-bottle spray attachment.","ask":"$120,000 for 20% equity.","offer":"A $180,000 Cuban/Rodriguez on-air agreement is reported; closing remains unresolved.","deal_closed":null}],"timeline":[{"date":"2021-01-15","event":"ABC's S12E10 roster lists Bubbly Blaster with Slice of Sauce, Love Is Project and Luna Magic.","source_ids":["BUBL-ABC"]},{"date":"2026-09-10","event":"The retrieved official storefront lists products and pricing.","source_ids":["BUBL-SITE"]}],"registry_records":[],"claims":[{"id":"BUBL-OPERATING","text":"The retrieved storefront supports an operating commercial web presence; fulfillment and state standing were not independently tested.","evidence_level":"verified_fact","source_ids":["BUBL-SITE"]},{"id":"BUBL-DEAL","text":"The on-air Cuban/Rodriguez agreement is not treated as closed financing. No executed closing or termination document was retrieved.","evidence_level":"unresolved","source_ids":["BUBL-ABC"]}],"sources":[{"id":"BUBL-ABC","title":"ABC — businesses from S12E10","url":"https://abc.com/news/febba6fd-cf91-428e-bc43-a3543a6a6845/category/2887649","source_type":"official episode roster","published":"2021-01-15","accessed":"2026-09-10"},{"id":"BUBL-SITE","title":"Bubbly Blaster official storefront","url":"https://bubblyblaster.com/","source_type":"company storefront","published":null,"accessed":"2026-09-10"}],"uncertainties":["Final investment terms, state standing, ownership changes and historical archive comparisons remain unresolved."]},
 {"company":{"name":"Buck Mason","aliases":["Buck Mason Inc.","Simple Man LLC"],"legal_entities":["Buck Mason Inc. (Florida foreign corporation F24000005396, active)","Simple Man LLC (historical FTC/trademark identity)"],"successor_or_acquirer":null},"status":"operating","as_of":"2026-09-10","confidence":"high","episode_appearances":[{"season":6,"episode":26,"episode_date":"2015-04-24","video_title":"ABC — businesses from S6E26","video_url":"https://abc.com/news/b9186d7e-ee7e-4b76-93bc-a13e98d269c3/category/1138628","kind":"episode","pitch":"Menswear.","ask":"$200,000 for 18% equity.","offer":"No Shark deal was completed on air.","deal_closed":false}],"timeline":[{"date":"2015-04-24","event":"ABC's S6E26 listing includes Buck Mason with ZinePak, SnagaStool and Noene USA.","source_ids":["BM-ABC"]},{"date":"2026-09-10","event":"Florida's entity record lists Buck Mason Inc. as active, and the official storefront remains current.","source_ids":["BM-FL","BM-SITE"]}],"registry_records":[{"jurisdiction":"Florida","entity_name":"Buck Mason Inc.","entity_number":"F24000005396","status":"active","events":[],"source_id":"BM-FL","accessed":"2026-09-10","limitation":"Florida standing is jurisdiction-specific and does not prove global corporate status."}],"claims":[{"id":"BM-OPERATING","text":"The official storefront and Florida active foreign-corporation record support operating commercial presence. A foreign-registration status in another state is not used to infer global closure.","evidence_level":"strong_corroboration","source_ids":["BM-SITE","BM-FL"]},{"id":"BM-DEAL","text":"This record treats the appearance as no deal; it does not infer later Shark ownership from the current business.","evidence_level":"credible_report","source_ids":["BM-ABC","BM-INC"]}],"sources":[{"id":"BM-ABC","title":"ABC — businesses from S6E26","url":"https://abc.com/news/b9186d7e-ee7e-4b76-93bc-a13e98d269c3/category/1138628","source_type":"official episode listing","published":"2015","accessed":"2026-09-10"},{"id":"BM-INC","title":"Inc. — Buck Mason Shark Tank recap","url":"https://www.inc.com/brian-j-oconnor/shark-tank-recap-welcome-to-daymond-john-s-land-of-the-clueless.html","source_type":"contemporaneous reporting","published":"2015-04","accessed":"2026-09-10"},{"id":"BM-FL","title":"Florida Division of Corporations — Buck Mason Inc.","url":"https://search.sunbiz.org/Inquiry/CorporationSearch/SearchResultDetail?aggregateId=forp-f24000005396-741a8b7e-a31b-4ddc-9c28-296c6ace7380&directionType=Initial&inquirytype=EntityName&searchNameOrder=BUCKMASON+F240000053960","source_type":"state entity record","published":null,"accessed":"2026-09-10"},{"id":"BM-SITE","title":"Buck Mason official storefront","url":"https://www.buckmason.com/","source_type":"company storefront","published":null,"accessed":"2026-09-10"}],"uncertainties":["Delaware standing, exact operator/trademark transition, later acquisitions and historical archive comparisons remain unresolved."]}
]
