[
  {"company":{"name":"Buffer Bit","aliases":["The Buffer Bit"],"legal_entities":[],"successor_or_acquirer":null},"status":"operating","as_of":"2026-09-10","confidence":"medium","episode_appearances":[{"season":5,"episode":19,"episode_date":"2014-03-07","video_title":"TVmaze — S5E19 roster","video_url":"https://www.tvmaze.com/episodes/31960/shark-tank-5x19-revolights-squeeky-knees-buffer-bit-u-lace","kind":"episode","pitch":"Drill-powered shoe-polishing attachment.","ask":"$75,000 for 25% equity.","offer":"No deal reported in contemporaneous recap coverage.","deal_closed":false}],"timeline":[{"date":"2014-03-07","event":"The retrieved S5E19 roster lists Buffer Bit with Revolights, Squeeky Knees and U-Lace.","source_ids":["BUF-EP"]},{"date":"2026-09-10","event":"The official storefront lists drill-powered polishing and scrubbing products.","source_ids":["BUF-SITE"]}],"registry_records":[],"claims":[{"id":"BUF-OPERATING","text":"The retrieved official storefront supports an operating commercial web presence; inventory, fulfillment and state standing were not independently tested.","evidence_level":"verified_fact","source_ids":["BUF-SITE"]},{"id":"BUF-DEAL","text":"Contemporaneous recap coverage reports no on-air deal. No later Shark ownership is inferred from the current storefront.","evidence_level":"credible_report","source_ids":["BUF-RECAP"]}],"sources":[{"id":"BUF-EP","title":"TVmaze — Shark Tank S5E19","url":"https://www.tvmaze.com/episodes/31960/shark-tank-5x19-revolights-squeeky-knees-buffer-bit-u-lace","source_type":"episode database","published":"2014-03-07","accessed":"2026-09-10"},{"id":"BUF-RECAP","title":"CarterMatt — S5E19 review","url":"https://cartermatt.com/112719/shark-tank-review-revolights-u-lace-the-buffer-bit-and-squeeky-knees/","source_type":"contemporaneous recap","published":"2014-03-07","accessed":"2026-09-10"},{"id":"BUF-SITE","title":"Buffer Bit official storefront","url":"https://www.bufferbit.com/","source_type":"company storefront","published":null,"accessed":"2026-09-10"}],"uncertainties":["Entity-specific standing, manufacturing ownership, fulfillment and historical archive comparison remain unresolved."]},
  {"company":{"name":"Bug Bite Thing","aliases":["Bug Bite Thing Inc."],"legal_entities":[],"successor_or_acquirer":null},"status":"operating","as_of":"2026-09-10","confidence":"high","episode_appearances":[{"season":11,"episode":4,"episode_date":"2019-10-20","video_title":"ABC — businesses from S11E4","video_url":"https://abc.com/news/fd12ffdc-af60-416c-906a-8b1847aca56c/category/2887649","kind":"episode","pitch":"Reusable suction tool for insect bites and stings.","ask":null,"offer":"The company says Lori Greiner's Golden Ticket offer secured a partnership; executed financing evidence was not retrieved.","deal_closed":null}],"timeline":[{"date":"2019-10-20","event":"ABC's S11E4 roster lists Bug Bite Thing with Knife Aid, Plop Star and Snacklins.","source_ids":["BBT-ABC"]},{"date":"2026-09-10","event":"The official company page describes a continuing retail and online presence.","source_ids":["BBT-SITE"]}],"registry_records":[],"claims":[{"id":"BBT-OPERATING","text":"The current official company page supports an operating commercial presence; it lists retail distribution and current products. Those company claims were not independently audited.","evidence_level":"verified_fact","source_ids":["BBT-SITE"]},{"id":"BBT-DEAL","text":"The company describes a Lori Greiner partnership, but that first-party statement is not treated as independently corroborated closing evidence because no executed investment record was retrieved.","evidence_level":"unresolved","source_ids":["BBT-SITE"]}],"sources":[{"id":"BBT-ABC","title":"ABC — businesses from S11E4","url":"https://abc.com/news/fd12ffdc-af60-416c-906a-8b1847aca56c/category/2887649","source_type":"official episode roster","published":"2019-10-20","accessed":"2026-09-10"},{"id":"BBT-SITE","title":"Bug Bite Thing official about page","url":"https://www.bugbitething.com/pages/about-us","source_type":"company history page","published":null,"accessed":"2026-09-10"}],"uncertainties":["Entity-specific standing, executed investment terms, ownership changes and historical archive comparison remain unresolved."]},
  {"company":{"name":"Buggy Beds","aliases":["BuggyBeds","VCM Products, LLC"],"legal_entities":["VCM Products, LLC (company footer self-identification; state standing unverified)"],"successor_or_acquirer":null},"status":"operating","as_of":"2026-09-10","confidence":"medium","episode_appearances":[{"season":4,"episode":2,"episode_date":null,"video_title":"ABC — Season 4 Buggy Beds listing","video_url":"https://abc.com/news/6fa9b206-7c9e-4abf-ae01-46a931d4a9e1/category/939724","kind":"episode","pitch":"Bedbug early-detection glue traps.","ask":null,"offer":"Secondary episode databases report an on-air five-Shark agreement; no executed closing document was retrieved.","deal_closed":null}],"timeline":[{"date":"2013","event":"ABC's retrieved Season 4 listing describes BuggyBeds' early-detection trap.","source_ids":["BGB-ABC"]},{"date":"2026-09-10","event":"The official storefront lists detector products and identifies VCM Products, LLC in its footer.","source_ids":["BGB-SITE"]}],"registry_records":[],"claims":[{"id":"BGB-OPERATING","text":"The current official storefront supports operating commercial presence. Its VCM Products, LLC footer is not represented as an entity-specific state registry result.","evidence_level":"verified_fact","source_ids":["BGB-SITE"]},{"id":"BGB-DEAL","text":"Reported on-air investment terms are not treated as closed financing. The executed investment, ownership and any later majority-stake transaction documents were not retrieved.","evidence_level":"unresolved","source_ids":["BGB-ABC"]}],"sources":[{"id":"BGB-ABC","title":"ABC — Season 4 Buggy Beds listing","url":"https://abc.com/news/6fa9b206-7c9e-4abf-ae01-46a931d4a9e1/category/939724","source_type":"official episode listing","published":"2013-06-24","accessed":"2026-09-10"},{"id":"BGB-SITE","title":"BuggyBeds official storefront","url":"https://buggybeds.com/","source_type":"company storefront","published":null,"accessed":"2026-09-10"}],"uncertainties":["Exact original episode number and air date, entity-specific New Jersey standing, executed investment documents, ownership changes and historical archive comparison remain unresolved."]},
  {"company":{"name":"Bumbling Bee","aliases":["The Bumbling Bee"],"legal_entities":[],"successor_or_acquirer":null},"status":"unresolved","as_of":"2026-09-10","confidence":"low","episode_appearances":[{"season":12,"episode":22,"episode_date":"2021-04-23","video_title":"ABC — businesses from S12E22","video_url":"https://abc.com/news/c65972da-caa9-4e9c-b0db-9e33ae7ab0da/category/2887649","kind":"episode","pitch":"Vegan junk-food restaurant and food-truck concept.","ask":null,"offer":"No deal reported by the retrieved episode database; a primary transaction record was not retrieved.","deal_closed":false}],"timeline":[{"date":"2021-04-23","event":"ABC's S12E22 roster lists The Bumbling Bee with Jiggy, The Scrubbie and XTorch.","source_ids":["BUMB-ABC"]}],"registry_records":[],"claims":[{"id":"BUMB-STATUS","text":"Current commercial and legal status remains unresolved. Third-party location directories label a Boulder restaurant permanently closed, but no entity-specific registry result, owner statement or dated archive comparison was retrieved to establish the business's final outcome.","evidence_level":"unresolved","source_ids":["BUMB-ABC"]},{"id":"BUMB-DEAL","text":"A secondary episode database reports no deal; it is not used to infer post-show ownership or legal status.","evidence_level":"credible_report","source_ids":["BUMB-EP"]}],"sources":[{"id":"BUMB-ABC","title":"ABC — businesses from S12E22","url":"https://abc.com/news/c65972da-caa9-4e9c-b0db-9e33ae7ab0da/category/2887649","source_type":"official episode roster","published":"2021-04-23","accessed":"2026-09-10"},{"id":"BUMB-EP","title":"Shark Tank Wiki — S12E22","url":"https://sharktank.fandom.com/wiki/Episode_1222","source_type":"episode database","published":null,"accessed":"2026-09-10"}],"uncertainties":["Entity-specific state standing, whether either former location remains under a successor, formal closure evidence, ownership changes and historical archive comparison remain unresolved."]}
]
