[
  {"company":{"name":"Bucket Golf","aliases":["BucketGolf"],"legal_entities":[],"successor_or_acquirer":null},"status":"operating","as_of":"2026-09-09","confidence":"medium","episode_appearances":[{"season":16,"episode":2,"episode_date":"2024-10-25","video_title":"ABC — businesses from S16E2","video_url":"https://abc.com/news/e8969ac2-cd44-4c0d-bf33-986b6aa33612/category/2887649","kind":"episode","pitch":"Portable lawn-golf game.","ask":"$1,000,000 for 10% equity.","offer":"A $1,000,000-for-12.5% Cuban agreement was televised; executed closing evidence was not retrieved.","deal_closed":null}],"timeline":[{"date":"2024-10-25","event":"ABC lists Bucket Golf and links the appearance to bucketgolfgame.com.","source_ids":["BG-ABC"]},{"date":"2026-09-09","event":"The official site uses the BucketGolf spelling and lists registered word and logo marks.","source_ids":["BG-SITE"]}],"registry_records":[],"claims":[{"id":"BG-IDENTITY","text":"Bucket Golf and BucketGolf are treated as one brand identity: ABC links the televised Bucket Golf appearance to bucketgolfgame.com, whose current legal page uses BucketGolf. This establishes brand naming, not a separate entity merger.","evidence_level":"strong_corroboration","source_ids":["BG-ABC","BG-SITE"]},{"id":"BG-OPERATING","text":"The current official site supports operating commercial presence. State entity standing, transaction closing, ownership and historical archive comparisons remain unverified.","evidence_level":"verified_fact","source_ids":["BG-SITE"]},{"id":"BG-DEAL","text":"The on-air Cuban agreement is retained as a televised agreement only. No executed investment or termination document was retrieved.","evidence_level":"unresolved","source_ids":["BG-ABC"]}],"sources":[{"id":"BG-ABC","title":"ABC — businesses from S16E2","url":"https://abc.com/news/e8969ac2-cd44-4c0d-bf33-986b6aa33612/category/2887649","source_type":"official episode roster","published":"2024-10-25","accessed":"2026-09-09"},{"id":"BG-SITE","title":"BucketGolf official legal page","url":"https://www.bucketgolfgame.com/pages/terms-and-conditions","source_type":"company legal page","published":null,"accessed":"2026-09-09"}],"uncertainties":["Entity-specific state standing, investment closing, ownership structure and historical archive comparison remain unresolved."]},
  {"company":{"name":"Buckle Me Baby Coats","aliases":["Buckle Me Baby"],"legal_entities":[],"successor_or_acquirer":null},"status":"operating","as_of":"2026-09-09","confidence":"medium","episode_appearances":[{"season":12,"episode":7,"episode_date":"2020-12-04","video_title":"ABC — businesses from S12E7","video_url":"https://abc.com/news/52bf9a72-2712-4806-b7c3-9c2f2529e61d/category/2887649","kind":"episode","pitch":"Car-seat-friendly children's coats.","ask":"$100,000 for 10% equity.","offer":"A $100,000-for-20% Daymond John agreement, plus licensing participation, was televised; closing evidence was not retrieved.","deal_closed":null}],"timeline":[{"date":"2020-12-04","event":"ABC's S12E7 roster lists Buckle Me Baby Coats with Holiball, Toilet Timer and ODR Skis.","source_ids":["BMB-ABC"]},{"date":"2026-09-09","event":"The official storefront lists current car-seat coats, blankets and sleep sacks.","source_ids":["BMB-SITE"]}],"registry_records":[],"claims":[{"id":"BMB-OPERATING","text":"The retrieved official storefront supports an operating commercial web presence; fulfillment and state standing were not independently tested.","evidence_level":"verified_fact","source_ids":["BMB-SITE"]},{"id":"BMB-DEAL","text":"The televised Daymond John agreement is not treated as closed financing. Conflicting secondary follow-ups were not promoted without executed transaction evidence or a directly attributable confirmation.","evidence_level":"unresolved","source_ids":["BMB-ABC"]}],"sources":[{"id":"BMB-ABC","title":"ABC — businesses from S12E7","url":"https://abc.com/news/52bf9a72-2712-4806-b7c3-9c2f2529e61d/category/2887649","source_type":"official episode roster","published":"2020-12-04","accessed":"2026-09-09"},{"id":"BMB-SITE","title":"Buckle Me Baby official storefront","url":"https://bucklemecoats.com/","source_type":"company storefront","published":null,"accessed":"2026-09-09"}],"uncertainties":["Entity-specific standing, executed investment terms, licensing terms, ownership changes and historical archive comparisons remain unresolved."]},
  {"company":{"name":"Budsies","aliases":["Budsies LLC","Budsies Co, LLC"],"legal_entities":["Budsies Co, LLC (Florida L20000391453, active)"],"successor_or_acquirer":null},"status":"operating","as_of":"2026-09-09","confidence":"high","episode_appearances":[{"season":6,"episode":24,"episode_date":"2015-04-10","video_title":"SharkTankDB — S6E24 roster","video_url":"https://sharktankdb.com/season/6/","kind":"episode","pitch":"Custom plush toys based on children's artwork.","ask":null,"offer":"No Shark deal is reported in the retrieved episode roster.","deal_closed":false}],"timeline":[{"date":"2015-04-10","event":"The retrieved S6E24 roster identifies Budsies with Bee Thinking, PullyPalz and Forus Athletics.","source_ids":["BUD-EP"]},{"date":"2021","event":"Budsies says founder Alex Furmansky passed ownership to Scott Meier.","source_ids":["BUD-SITE"]},{"date":"2026-09-09","event":"Florida lists Budsies Co, LLC as active, with a 2026 annual report.","source_ids":["BUD-FL"]}],"registry_records":[{"jurisdiction":"Florida","entity_name":"Budsies Co, LLC","entity_number":"L20000391453","status":"active","events":["2026 annual report filed"],"source_id":"BUD-FL","accessed":"2026-09-09","limitation":"This supports the named Florida entity's standing, not a complete chain of title for historical Budsies assets."}],"claims":[{"id":"BUD-OPERATING","text":"Budsies' current company page and Florida's active Budsies Co, LLC record support operating commercial presence.","evidence_level":"strong_corroboration","source_ids":["BUD-SITE","BUD-FL"]},{"id":"BUD-OWNERSHIP","text":"The company says Alex Furmansky passed ownership to Scott Meier in 2021. The entity and asset-transfer documents were not retrieved, so no broader transaction structure is inferred.","evidence_level":"verified_fact","source_ids":["BUD-SITE"]},{"id":"BUD-DEAL","text":"The episode roster reports no Shark deal. No later Shark ownership is inferred from the continuing business.","evidence_level":"credible_report","source_ids":["BUD-EP"]}],"sources":[{"id":"BUD-EP","title":"SharkTankDB — Season 6 episode roster","url":"https://sharktankdb.com/season/6/","source_type":"episode database","published":null,"accessed":"2026-09-09"},{"id":"BUD-SITE","title":"Budsies official history","url":"https://www.budsies.com/about/","source_type":"company history page","published":null,"accessed":"2026-09-09"},{"id":"BUD-FL","title":"Florida Division of Corporations — Budsies Co, LLC","url":"https://search.sunbiz.org/Inquiry/corporationsearch/SearchResultDetail?aggregateId=flal-l20000391453-6dbac1c6-e1a4-4e6f-9e1f-b482348f002e&directionType=Initial&inquirytype=EntityName&listNameOrder=BUDSIES+L130000477480&searchNameOrder=BUDSIES+L200003914530&searchTerm=BUDSIES+CO%2C+LLC","source_type":"state entity record","published":null,"accessed":"2026-09-09"}],"uncertainties":["Historic Budsies LLC standing, asset-transfer documents, non-Florida registrations and historical archive comparison remain unresolved."]},
  {"company":{"name":"Buena Papa","aliases":["Buena Papa Fry Bar"],"legal_entities":[],"successor_or_acquirer":null},"status":"operating","as_of":"2026-09-09","confidence":"medium","episode_appearances":[{"season":15,"episode":4,"episode_date":"2023-10-20","video_title":"ABC — businesses from S15E4","video_url":"https://abc.com/news/755fd719-153d-404d-a315-818eb87d8a9d/category/2887649","kind":"episode","pitch":"Globally inspired loaded-fry restaurant concept.","ask":"$400,000 for 7% equity.","offer":"A Robert Herjavec agreement was televised; executed closing evidence was not retrieved.","deal_closed":null}],"timeline":[{"date":"2023-10-20","event":"ABC's S15E4 roster lists Buena Papa with PaddleSmash, FairyTail Pet Care and MONOSUIT.","source_ids":["BP-ABC"]},{"date":"2026-09-09","event":"The official site promotes Buena Papa Fry Bar franchise opportunities.","source_ids":["BP-SITE"]}],"registry_records":[],"claims":[{"id":"BP-OPERATING","text":"The retrieved official site supports an operating commercial and franchise presence. Locations, franchise sales, entity standing and fulfillment were not independently verified.","evidence_level":"verified_fact","source_ids":["BP-SITE"]},{"id":"BP-DEAL","text":"The televised Robert Herjavec agreement is not treated as closed financing. No executed investment, termination or shareholder document was retrieved.","evidence_level":"unresolved","source_ids":["BP-ABC"]}],"sources":[{"id":"BP-ABC","title":"ABC — businesses from S15E4","url":"https://abc.com/news/755fd719-153d-404d-a315-818eb87d8a9d/category/2887649","source_type":"official episode roster","published":"2023-10-20","accessed":"2026-09-09"},{"id":"BP-SITE","title":"Buena Papa official television and franchise page","url":"https://www.buenapapa.com/asseenontv","source_type":"company page","published":null,"accessed":"2026-09-09"}],"uncertainties":["Entity-specific standing, executed investment terms, franchise system records, ownership changes and historical archive comparisons remain unresolved."]}
]
