[
 {"company":{"name":"Cab 20","aliases":["CAB 20"],"legal_entities":[],"successor_or_acquirer":null},"status":"unresolved","as_of":"2026-09-10","confidence":"low","episode_appearances":[{"season":3,"episode":15,"episode_date":"2012-05-11","video_title":"ABC — Season 3, episode 15","video_url":"https://abc.com/news/247086f7-cd09-4c1f-9e9d-db01f20ff1fe/category/939724","kind":"episode","pitch":"Funding for an independent rock band.","ask":"$200,000 for 20% equity.","offer":"Contemporary reporting says a joint $200,000-for-50% offer was not accepted.","deal_closed":false}],"timeline":[{"date":"2012-05-14","event":"Contemporary ABC-related reporting records an unaccepted O'Leary/Herjavec offer.","source_ids":["CAB-OFFER"]},{"date":"2026-09-10","event":"No current first-party Cab 20 business presence was retrieved; later inactivity reporting alone does not establish a legal outcome.","source_ids":["CAB-ABC"]}],"registry_records":[],"claims":[{"id":"CAB-DEAL","text":"The reported offer was not accepted, so no Shark financing is asserted.","evidence_level":"credible_report","source_ids":["CAB-OFFER"]},{"id":"CAB-STATUS","text":"Current band, ownership and legal status remain unresolved; the tracker does not convert later inactivity reporting into a definitive dissolution claim.","evidence_level":"unresolved","source_ids":["CAB-ABC"]}],"sources":[{"id":"CAB-ABC","title":"ABC — Season 3, episode 15","url":"https://abc.com/news/247086f7-cd09-4c1f-9e9d-db01f20ff1fe/category/939724","source_type":"official episode page","published":"2013-07-25","accessed":"2026-09-10"},{"id":"CAB-OFFER","title":"Contemporary Shark Tank investment-offer report","url":"https://www.broadwayworld.com/bwwtv/article/ABCs-SHARK-TANK-Passes-4-Million-Investment-Offer-Mark-20120514","source_type":"contemporary entertainment report","published":"2012-05-14","accessed":"2026-09-10"}],"uncertainties":["Current commercial activity, entity-specific standing, ownership, successor and archive comparison remain unresolved."]},
 {"company":{"name":"Cabana Boys","aliases":["Cabana Boys Events","Cocktail CowBoys"],"legal_entities":[],"successor_or_acquirer":null},"status":"operating","as_of":"2026-09-10","confidence":"high","episode_appearances":[{"season":17,"episode":9,"episode_date":"2026-01-14","video_title":"ABC — businesses from S17E9","video_url":"https://abc.com/news/fdf77313-5469-4c8b-958c-3c99d066cf60/category/2887649","kind":"episode","pitch":"Party-hosting and bartending services.","ask":null,"offer":"Company says it received a televised Kendra Scott deal; executed closing evidence was not retrieved.","deal_closed":null}],"timeline":[{"date":"2026-01-14","event":"ABC lists Cabana Boys Events with Bon Appesweet, Sleepy Baby and Makers Social.","source_ids":["CB-ABC"]},{"date":"2026-09-10","event":"The company maintains a current service site across ten locations.","source_ids":["CB-SITE"]}],"registry_records":[],"claims":[{"id":"CB-OPERATING","text":"ABC's roster and the current first-party service site support operating commercial presence; state standing and fulfillment were not independently tested.","evidence_level":"strong_corroboration","source_ids":["CB-ABC","CB-SITE"]},{"id":"CB-DEAL","text":"The company's reference to a televised Kendra Scott deal is not treated as closed financing without transaction evidence.","evidence_level":"unresolved","source_ids":["CB-SITE"]}],"sources":[{"id":"CB-ABC","title":"ABC — businesses from S17E9","url":"https://abc.com/news/fdf77313-5469-4c8b-958c-3c99d066cf60/category/2887649","source_type":"official episode roster","published":"2026-01-14","accessed":"2026-09-10"},{"id":"CB-SITE","title":"Cabana Boys official about page","url":"https://partyhostboys.com/about-us/","source_type":"company page","published":null,"accessed":"2026-09-10"}],"uncertainties":["Entity-specific standing, executed investment terms, ownership and archive comparison remain unresolved."]},
 {"company":{"name":"Cabinet Health","aliases":["Cabinet Health Inc."],"legal_entities":["Cabinet Health Inc. (identified by CPSC)"],"successor_or_acquirer":null},"status":"operating","as_of":"2026-09-10","confidence":"high","episode_appearances":[{"season":14,"episode":11,"episode_date":"2023-01-13","video_title":"ABC — businesses from S14E11","video_url":"https://abc.com/news/f6434549-da31-4c33-80a2-2db77fd02652/category/2887649","kind":"episode","pitch":"Refillable and compostable medicine system.","ask":"$500,000 for 2.5% equity.","offer":"Reported televised agreement; closing evidence was not retrieved.","deal_closed":null}],"timeline":[{"date":"2023-01-13","event":"ABC lists Cabinet Health with Kinfield, Metric Mate and wildwonder.","source_ids":["CH-ABC"]},{"date":"2025-01-30","event":"CPSC announced a recall of about 65,000 specified refillable medicine bottles due to child-resistance degradation.","source_ids":["CH-CPSC"]}],"registry_records":[{"jurisdiction":"United States CPSC recall","entity_name":"Cabinet Health Inc.","entity_number":"Recall 25-110","status":"recall remedy: replacement lid","events":["January 2025 bottle recall"],"source_id":"CH-CPSC","accessed":"2026-09-10","limitation":"A product recall identifies the responsible company and remedy; it is not state good standing or a company-wide closure finding."}],"claims":[{"id":"CH-RECALL","text":"The recall covers specified 4 oz. refillable bottles and a replacement-lid remedy. It does not establish a company closure or apply to all products.","evidence_level":"verified_fact","source_ids":["CH-CPSC"]},{"id":"CH-DEAL","text":"The televised agreement is not treated as closed financing without executed transaction evidence.","evidence_level":"unresolved","source_ids":["CH-ABC"]}],"sources":[{"id":"CH-ABC","title":"ABC — businesses from S14E11","url":"https://abc.com/news/f6434549-da31-4c33-80a2-2db77fd02652/category/2887649","source_type":"official episode roster","published":"2023-01-13","accessed":"2026-09-10"},{"id":"CH-CPSC","title":"CPSC — Cabinet Health bottle recall 25-110","url":"https://www.cpsc.gov/Recalls/2025/Cabinet-Health-Recalls-4-oz-Refillable-Medicine-Bottles-Due-to-Failure-to-Retain-Child-Resistance-Risk-of-Child-Poisoning","source_type":"federal product-safety recall","published":"2025-01-30","accessed":"2026-09-10"}],"uncertainties":["Entity-specific state standing, current product portfolio, executed investment terms, ownership and archive comparison remain unresolved."]},
 {"company":{"name":"Caddy Girls","aliases":["The Caddy Girls"],"legal_entities":[],"successor_or_acquirer":null},"status":"operating","as_of":"2026-09-10","confidence":"medium","episode_appearances":[{"season":6,"episode":5,"episode_date":"2014-10-17","video_title":"TVmaze — Shark Tank S6E5","video_url":"https://www.tvmaze.com/episodes/31975/shark-tank-6x05-week-4-jungle-jumparoo-the-caddy-girls-red-dress-boutique-sun-staches","kind":"episode","pitch":"All-female golf-caddy and event staffing service.","ask":"$100,000 for 20% equity.","offer":"Secondary recap reports an unaccepted $100,000-for-50% offer.","deal_closed":false}],"timeline":[{"date":"2014-10-17","event":"The retrieved episode listing places The Caddy Girls with Jungle Jumparoo, Red Dress Boutique and Sun-Staches.","source_ids":["CG-EP"]},{"date":"2026-09-10","event":"The current company site offers caddy and event-talent booking plus gift certificates.","source_ids":["CG-SITE"]}],"registry_records":[],"claims":[{"id":"CG-OPERATING","text":"The current first-party site supports operating service presence; state standing and fulfillment were not independently tested.","evidence_level":"verified_fact","source_ids":["CG-SITE"]},{"id":"CG-DEAL","text":"Secondary recap reporting supports that the televised offer was declined; this is not a primary transaction record.","evidence_level":"credible_report","source_ids":["CG-EP"]}],"sources":[{"id":"CG-EP","title":"TVmaze — Shark Tank S6E5","url":"https://www.tvmaze.com/episodes/31975/shark-tank-6x05-week-4-jungle-jumparoo-the-caddy-girls-red-dress-boutique-sun-staches","source_type":"episode database","published":"2014-10-17","accessed":"2026-09-10"},{"id":"CG-SITE","title":"The Caddy Girls official site","url":"https://www.thecaddygirls.com/","source_type":"company service site","published":null,"accessed":"2026-09-10"}],"uncertainties":["Entity-specific standing, ownership, underlying offer terms and archive comparison remain unresolved."]}
]
